{
  "$schema": "../../../schemas/herald-oss/rest-contract.schema.json",
  "id": "live-viewer-admin",
  "title": "Live Viewer admin REST contract — the tenant-scoped API the Dashboard SPA depends on",
  "status": "implemented-fakeserver",
  "first-defined": "2026-05-21",
  "contract-package": "Herald.RestApi.Contracts (LiveViewer/*.cs) — ILiveViewerAdminApi + the Level/Category/Enricher DTOs. The wire shape is what the SPA depends on; the package is where the shape is defined.",
  "scope": {
    "statement": "The Live Viewer admin family is the tenant-scoped REST surface the Dashboard SPA reads to hydrate its panels and writes to program the pipeline live. Every route is scoped to one tenant and one pipeline: `/api/tenants/{tenantId}/pipelines/{pipelineId}/...`. The family covers a read snapshot (`GET .../live-viewer`), the level / category / enricher mutation panels, the configured-sink instance list, and the SSE config-change channel that tells other tabs to re-hydrate after a peer made a change.",
    "in-scope": [
      "The read snapshot: GET /live-viewer returns a LiveViewerState the SPA hydrates its Pinia stores from on boot",
      "Per-level admin: style, minimum-level floor, flight-recorder threshold, reorder, create, delete",
      "Per-category admin: style, active toggle, create, delete",
      "Per-enricher admin: style, active toggle, create, delete, opaque kind-config",
      "The configured-sink instance list: GET /sinks (projected from the bootstrap), plus the sink mutation family",
      "The SSE config-change channel: a cross-tab awareness hint, not a state-delivery channel"
    ],
    "out-of-scope": [
      "Focus-lane assignment (FOCUS 1 / FOCUS 2 triangles) and banding bucket size — operator-local, persisted in browser localStorage only; no server route exists in this Contracts version (see live-viewer-port-plan §§3.7, 3.9, wave-1 ratification D2/D3)",
      "The live log feed itself — that arrives on the per-tenant event stream (GET /api/tenants/{tenantId}/events/stream), a separate channel from config-change",
      "Pipeline identity CRUD (create/delete whole pipelines) — that is the IPipelineAdminApi family, not this one",
      "Sink download/install (NuGet pull) — a separate concern from configuring an already-loaded sink (project_sink_catalog_model)"
    ]
  },
  "auth": {
    "read-capability": "ReadTenant — a read-only principal that can list pipelines can also hydrate their Live Viewer state",
    "write-capability": "WriteTenant — the same capability IPipelineAdminApi.UpdateAsync uses; no new capability bit was introduced",
    "scoping": "Every capability check is scoped to the route's tenant. A principal scoped to a different tenant is rejected with HTTP 403.",
    "demo-note": "The DemoApp no-auth path injects a static principal granted system-administer plus every Pro/Enterprise capability, so the demo exercises the full write surface against the FakeServer. Production hosts never run in this mode; the startup banner says so."
  },
  "timing-contract": "PATCH-200 means accepted-and-queryable: by the time a 2xx response reaches the caller, a follow-up GET against the same pipeline reflects the new state. There is no convergence-polling requirement and no 'wait for the SSE event' requirement for the originating caller. Every PATCH is idempotent at the field level — sending the same payload twice produces the same result.",
  "shared-shapes": [
    {
      "name": "LiveViewerState",
      "kind": "response",
      "summary": "The per-pipeline snapshot GET /live-viewer returns. The read-side companion to the mutation surface. Carries each resource family with its current contents AND the list ETag at the moment of the read, so a caller that then issues a reorder/create/delete can pass the ETag to participate in the optimistic-concurrency check.",
      "fields": [
        { "name": "levels", "type": "LevelDto[]", "notes": "Current level list, priority-ordered 1..N." },
        { "name": "levelsETag", "type": "ETag", "notes": "List-version token for the levels list." },
        { "name": "categories", "type": "CategoryDto[]", "notes": "Current category list. Herald.OSS ships none; the panel fills from the live feed." },
        { "name": "categoriesETag", "type": "ETag" },
        { "name": "enrichers", "type": "EnricherDto[]", "notes": "Current enricher panel, keyed by emitted FIELD name (snake_case), not class name." },
        { "name": "enrichersETag", "type": "ETag" },
        { "name": "minLevelPriority", "type": "int?", "nullable": true, "notes": "Minimum-visible-level floor as a 1-based priority. Null = no floor; accept every level emitted." },
        { "name": "flightRecorderPriority", "type": "int", "notes": "Flight-recorder threshold priority." },
        { "name": "flightRecorderEnabled", "type": "bool", "notes": "Whether FR is armed." },
        { "name": "flightRecorderPresent", "type": "bool", "notes": "True iff a flightRecorder logger entry exists in the bootstrap loggers[]. Distinct from Enabled: 'FR removed' (Present=false) and 'FR present but disarmed' (Present=true, Enabled=false) are distinguishable on the wire. Trailing + defaulted false for back-compat." }
      ]
    },
    {
      "name": "LevelDto",
      "kind": "value",
      "summary": "One per-pipeline level.",
      "fields": [
        { "name": "id", "type": "LevelId", "notes": "Stable per-pipeline level id. For seeded levels the id IS the name (NAME-bound identity)." },
        { "name": "name", "type": "string", "notes": "Display name (e.g. Error, Warning)." },
        { "name": "priority", "type": "int", "notes": "Position in the level list, 1..N, contiguous and unique." },
        { "name": "style", "type": "LevelStyle" }
      ]
    },
    {
      "name": "LevelStyle / CategoryStyle / EnricherStyle",
      "kind": "value",
      "summary": "Rendering style for a token in the feed. Three distinct types with the identical shape, kept separate so per-level / per-category / per-enricher styles cannot be mixed at the call boundary.",
      "fields": [
        { "name": "color", "type": "string", "notes": "Foreground hex (e.g. #FF6B6B)." },
        { "name": "bg", "type": "string?", "nullable": true, "notes": "Optional background hex; null leaves the row/token background unchanged." },
        { "name": "bold", "type": "bool" },
        { "name": "italic", "type": "bool" },
        { "name": "underline", "type": "bool" },
        { "name": "strike", "type": "bool" }
      ]
    },
    {
      "name": "CategoryDto",
      "kind": "value",
      "summary": "One per-pipeline category.",
      "fields": [
        { "name": "id", "type": "CategoryId" },
        { "name": "name", "type": "string" },
        { "name": "style", "type": "CategoryStyle" },
        { "name": "active", "type": "bool", "notes": "Whether the category contributes to the live feed." }
      ]
    },
    {
      "name": "EnricherDto",
      "kind": "value",
      "summary": "One per-pipeline enricher panel row, keyed by emitted FIELD name (snake_case), not by the Core class name. One class can emit several fields, so the panel is per-field.",
      "fields": [
        { "name": "id", "type": "EnricherId", "notes": "The snake field-name; equals the SSE enrichers{} key and the SPA tint-match id — one id end to end." },
        { "name": "name", "type": "string" },
        { "name": "style", "type": "EnricherStyle" },
        { "name": "active", "type": "bool", "notes": "Whether the enricher contributes to pipeline events." }
      ]
    },
    {
      "name": "Pipeline",
      "kind": "response",
      "summary": "Every mutating call returns the post-mutation Pipeline envelope (the same shape IPipelineAdminApi uses) so the caller can update its modified-at timestamp without a follow-up GET.",
      "fields": [
        { "name": "(IPipelineAdminApi.Pipeline)", "type": "record", "notes": "Canonical pipeline envelope; the mutation routes return this rather than the LiveViewerState. Re-hydrate via GET /live-viewer when the full snapshot is needed." }
      ]
    },
    {
      "name": "ETag",
      "kind": "value",
      "summary": "List-version token for optimistic concurrency. ETag.Unconditional means 'no If-Match precondition'.",
      "fields": [
        { "name": "value", "type": "string", "notes": "Opaque token. Pass the value observed on the hydrating GET into a reorder/delete request to participate in the concurrency check." }
      ]
    }
  ],
  "routes": [
    {
      "method": "GET",
      "path": "/api/tenants/{tenantId}/pipelines/{pipelineId}/live-viewer",
      "summary": "Returns the per-pipeline LiveViewerState snapshot — levels, categories, enrichers, list ETags, minimum-level floor, and flight-recorder config. The SPA's boot-time hydration call, and the call it repeats after the SSE config-change channel signals a peer mutated state.",
      "response-shape": "LiveViewerState",
      "status-codes": [
        { "code": "200", "meaning": "Snapshot returned." },
        { "code": "404", "meaning": "Pipeline does not exist (NotFoundException)." },
        { "code": "403", "meaning": "Principal scoped to a different tenant." }
      ],
      "idempotent": true,
      "etag": "none",
      "notes": "Read-only — gates on ReadTenant. Repeated calls between mutations return byte-identical state. This is the route whose absence caused the DemoApp `HTTP 404` banner before the FakeServer became the demo (see planning record demoapp-jsx-server-api-gap)."
    },
    {
      "method": "PATCH",
      "path": "/api/tenants/{tenantId}/pipelines/{pipelineId}/levels/{levelId}/style",
      "section": "live-viewer-port-plan §3.1",
      "summary": "Replaces the entire rendering style for one level. Fired by StyleDialog Save in the Levels drawer.",
      "request-shape": "UpdateLevelStyleRequest { Style: LevelStyle }",
      "response-shape": "Pipeline",
      "status-codes": [
        { "code": "200", "meaning": "Style applied." },